{
  "schema_version": "tracked-binary-review/1",
  "receipt_kind": "tracked_repository_binary_privacy_review",
  "review_basis_commit": "719d91dad5d6cc6f04acf6b31c4e8d005c68f94a",
  "binary_set_digest": "4b05d4deacf26d7710a03d5f28c17447a58fc65c43471957d7343be542ea15b6",
  "records": [
    {
      "path": "cisco_toolkit/data/oui_registry.tsv.gz",
      "git_blob_oid": "2419d2cc38d59904a463d2e5c14a1b469ada7a8a",
      "raw_sha256": "2120d5ca8a07cd320d480c6b5bcb5cd810c877cb70a5c949e2d635891e48a51a",
      "raw_bytes": 563919,
      "media_type": "application/gzip",
      "format": "gzip_tsv",
      "automated_format_evidence": {
        "kind": "gzip_tsv",
        "validator": "atlas_gzip_tsv_strict/1",
        "format_valid": true,
        "member_count": 1,
        "header_flags": 0,
        "header_mtime": 0,
        "header_xfl": 2,
        "header_os": 10,
        "trailer_crc32": "8e38a58c",
        "trailer_isize": 1815956,
        "uncompressed_bytes": 1815956,
        "uncompressed_sha256": "5bae084489f21916c573d7159907ab9c4543b0f6bd786a7a40c7abe2655cca19",
        "tsv_header_mode": "declared_schema_no_physical_header",
        "tsv_header": [
          "prefix_hex",
          "prefix_bits",
          "vendor"
        ],
        "column_count": 3,
        "row_count": 53486,
        "forbidden_content_findings": 0
      },
      "independent_review": {
        "reviewer_kind": "independent_agent",
        "reviewer_role": "binary_privacy_verifier",
        "independent_from_proposer": true,
        "review_scope": "decoded_tsv_rows_and_context",
        "evidence_references": [
          "decoded-tsv-sha256:5bae084489f21916c573d7159907ab9c4543b0f6bd786a7a40c7abe2655cca19",
          "privacy-scan:forbidden-local-generic-identities",
          "registry-validation:retained-source-and-runtime-loader"
        ],
        "verdict": "pass"
      }
    },
    {
      "path": "cisco_toolkit/data/port_registry.tsv.gz",
      "git_blob_oid": "fecefb35a29dfa18265d983afe039492c8bd2a2c",
      "raw_sha256": "3fcfa1c38e5cb7b7acf6a740f75214a3c8bfa000cb7df422593682045dea8519",
      "raw_bytes": 145622,
      "media_type": "application/gzip",
      "format": "gzip_tsv",
      "automated_format_evidence": {
        "kind": "gzip_tsv",
        "validator": "atlas_gzip_tsv_strict/1",
        "format_valid": true,
        "member_count": 1,
        "header_flags": 0,
        "header_mtime": 0,
        "header_xfl": 2,
        "header_os": 10,
        "trailer_crc32": "edd5d61d",
        "trailer_isize": 772832,
        "uncompressed_bytes": 772832,
        "uncompressed_sha256": "b45b87bcdf9a63363163fd8c1d002bea03a0ca1e557bea01c9c88bceeb1f9c68",
        "tsv_header_mode": "declared_schema_no_physical_header",
        "tsv_header": [
          "key",
          "protocol",
          "service",
          "alias_records_json",
          "category",
          "broadcast",
          "note",
          "assignment_source",
          "semantics_source",
          "overlay_service",
          "overlay_note",
          "overlay_status"
        ],
        "column_count": 12,
        "row_count": 12373,
        "forbidden_content_findings": 0
      },
      "independent_review": {
        "reviewer_kind": "independent_agent",
        "reviewer_role": "binary_privacy_verifier",
        "independent_from_proposer": true,
        "review_scope": "decoded_tsv_rows_and_context",
        "evidence_references": [
          "decoded-tsv-sha256:b45b87bcdf9a63363163fd8c1d002bea03a0ca1e557bea01c9c88bceeb1f9c68",
          "privacy-scan:forbidden-local-generic-identities",
          "registry-validation:retained-source-and-runtime-loader"
        ],
        "verdict": "pass"
      }
    },
    {
      "path": "master-reference/public/atlas-social-card.png",
      "git_blob_oid": "903c562481bea3758eb784a387b7b85cac745365",
      "raw_sha256": "15854acd763600b578913cc263b3b48e56474b042f5713185e121f6f90545828",
      "raw_bytes": 1766077,
      "media_type": "image/png",
      "format": "png",
      "automated_format_evidence": {
        "kind": "png",
        "validator": "atlas_png_strict/1",
        "format_valid": true,
        "crc_valid": true,
        "chunk_order_valid": true,
        "idat_framing_valid": true,
        "trailing_bytes": 0,
        "width": 1731,
        "height": 909,
        "bit_depth": 8,
        "color_type": 2,
        "interlace_method": 0,
        "chunk_count": 30,
        "idat_chunk_count": 27,
        "idat_compressed_bytes": 1740786,
        "decoded_scanline_bytes": 4721346,
        "decoded_scanline_sha256": "dfbb30d5dbdc46e6c25b1faf00e7da19d4b7cd457dd67e046a41d2612c92efff",
        "risky_metadata_chunk_counts": {
          "eXIf": 0,
          "iCCP": 0,
          "iTXt": 0,
          "tEXt": 0,
          "zTXt": 0
        },
        "forbidden_content_findings": 0
      },
      "independent_review": {
        "reviewer_kind": "independent_agent",
        "reviewer_role": "binary_privacy_verifier",
        "independent_from_proposer": true,
        "review_scope": "rendered_pixels_and_context",
        "evidence_references": [
          "decoded-rgba-sha256:b13ca10435afbfec3ebba0921423fd912d39c8bb61aad06c452a7a935063cd1d",
          "privacy-scan:forbidden-local-generic-identities",
          "visual-review:exact-rendered-pixels"
        ],
        "verdict": "pass"
      }
    },
    {
      "path": "master-reference/public/og.png",
      "git_blob_oid": "a3bc7ec2f626fd34bc110f44fbbfad76adb77af2",
      "raw_sha256": "ea17869f8f9f1a933e6d14ffed48d51fad2908c293d5eb439f4d61218b1cc208",
      "raw_bytes": 2338417,
      "media_type": "image/png",
      "format": "png",
      "automated_format_evidence": {
        "kind": "png",
        "validator": "atlas_png_strict/1",
        "format_valid": true,
        "crc_valid": true,
        "chunk_order_valid": true,
        "idat_framing_valid": true,
        "trailing_bytes": 0,
        "width": 1730,
        "height": 909,
        "bit_depth": 8,
        "color_type": 2,
        "interlace_method": 0,
        "chunk_count": 39,
        "idat_chunk_count": 36,
        "idat_compressed_bytes": 2313018,
        "decoded_scanline_bytes": 4718619,
        "decoded_scanline_sha256": "28bb87feff1ba618e96796376d7e9e14f72d948491b35b6461dac9d43d1a95b4",
        "risky_metadata_chunk_counts": {
          "eXIf": 0,
          "iCCP": 0,
          "iTXt": 0,
          "tEXt": 0,
          "zTXt": 0
        },
        "forbidden_content_findings": 0
      },
      "independent_review": {
        "reviewer_kind": "independent_agent",
        "reviewer_role": "binary_privacy_verifier",
        "independent_from_proposer": true,
        "review_scope": "rendered_pixels_and_context",
        "evidence_references": [
          "decoded-rgba-sha256:115b909dd6645467577a2c57c58cb3531714aafdf1035bc086570d39f0c29809",
          "privacy-scan:forbidden-local-generic-identities",
          "visual-review:exact-rendered-pixels"
        ],
        "verdict": "pass"
      }
    },
    {
      "path": "webapp/frontend/visual-e2e/__screenshots__/windows-2025-x64/ArchReviewPanel-728.png",
      "git_blob_oid": "096557739e16e66f8f12d8ce5ed9e54ce5ad0c75",
      "raw_sha256": "1d58216b730a2387a491610583891002b4c12fcb0637702cd3d880dd810f4c09",
      "raw_bytes": 56781,
      "media_type": "image/png",
      "format": "png",
      "automated_format_evidence": {
        "kind": "png",
        "validator": "atlas_png_strict/1",
        "format_valid": true,
        "crc_valid": true,
        "chunk_order_valid": true,
        "idat_framing_valid": true,
        "trailing_bytes": 0,
        "width": 728,
        "height": 700,
        "bit_depth": 8,
        "color_type": 2,
        "interlace_method": 0,
        "chunk_count": 17,
        "idat_chunk_count": 15,
        "idat_compressed_bytes": 56556,
        "decoded_scanline_bytes": 1529500,
        "decoded_scanline_sha256": "e5c37ead3246cd02cefe7262276e4128a959accbe4ae25a785bc8e17200e10d0",
        "risky_metadata_chunk_counts": {
          "eXIf": 0,
          "iCCP": 0,
          "iTXt": 0,
          "tEXt": 0,
          "zTXt": 0
        },
        "forbidden_content_findings": 0
      },
      "independent_review": {
        "reviewer_kind": "independent_agent",
        "reviewer_role": "binary_privacy_verifier",
        "independent_from_proposer": true,
        "review_scope": "rendered_pixels_and_context",
        "evidence_references": [
          "decoded-rgba-sha256:0667743308f8f53457370a7c1e30b2fece012e6b52c3b0962c977f5dd58115d4",
          "privacy-scan:forbidden-local-generic-identities",
          "visual-review:exact-rendered-pixels"
        ],
        "verdict": "pass"
      }
    },
    {
      "path": "webapp/frontend/visual-e2e/__screenshots__/windows-2025-x64/ArchReviewPanel.png",
      "git_blob_oid": "5c488869a99b3f45c85f6c4f54e1d32cf9a17b6a",
      "raw_sha256": "b3b94ce5865b073ddd456b5853e3b460e2231f34fcc784dcaf48d9e3eda0a45b",
      "raw_bytes": 56766,
      "media_type": "image/png",
      "format": "png",
      "automated_format_evidence": {
        "kind": "png",
        "validator": "atlas_png_strict/1",
        "format_valid": true,
        "crc_valid": true,
        "chunk_order_valid": true,
        "idat_framing_valid": true,
        "trailing_bytes": 0,
        "width": 900,
        "height": 700,
        "bit_depth": 8,
        "color_type": 2,
        "interlace_method": 0,
        "chunk_count": 17,
        "idat_chunk_count": 15,
        "idat_compressed_bytes": 56541,
        "decoded_scanline_bytes": 1890700,
        "decoded_scanline_sha256": "7dbf0958b95875178dd9f26f37d781eaa3e2cf23856b50679c47e9c1a645193e",
        "risky_metadata_chunk_counts": {
          "eXIf": 0,
          "iCCP": 0,
          "iTXt": 0,
          "tEXt": 0,
          "zTXt": 0
        },
        "forbidden_content_findings": 0
      },
      "independent_review": {
        "reviewer_kind": "independent_agent",